{
  "artifacts": [
    {
      "bytes": 105042944,
      "path": "C:\\Dev\\Fable2Recomp\\out\\build\\win-amd64-release\\fable2.exe",
      "role": "normal native executable",
      "sha256": "1642ED03BD8B117A8FED6E9FF912AD49CBF0E91A4E1D226B20C266925E3FF2C9"
    },
    {
      "bytes": 7721,
      "path": "C:\\Dev\\Fable2Recomp\\out\\phase5a\\tranche-001\\save-handoff-inventory.json",
      "role": "endpoint inventory",
      "sha256": "888D31FFEFF1ECC7FD632F204C1EBE3BAD131297A8AD0AF29D88CC9DAE1E9F36"
    },
    {
      "bytes": 2402,
      "path": "C:\\Dev\\Fable2Recomp\\out\\phase5a\\sessions\\phase5a-native-001\\Launch.ps1",
      "role": "launch command card",
      "sha256": "CB876E02B86F6CD1E583958DDD59BBBE92618E5103A823EDBE920A693A9FA8DB"
    }
  ],
  "build": {
    "branch": "fable2-phase5a-runtime-coverage",
    "executable": "C:\\Dev\\Fable2Recomp\\out\\build\\win-amd64-release\\fable2.exe",
    "executable_sha256": "1642ED03BD8B117A8FED6E9FF912AD49CBF0E91A4E1D226B20C266925E3FF2C9",
    "fault_walk": false,
    "fault_walk_dispatch": false,
    "gpu_plugin_sha256": "70492C8612DEF79C9E3946817F424111FAB2155A3BE63CEA6E717CA73893ADC5",
    "head": "6760651b01e4a1b1caefc3f00e5a6d0d5d2c5e02",
    "manifest_sha256": "07B142A69AB3400BEF72086C65B052A3B18CAC8BAAD03E8A720FD1E2F0648330",
    "sdk_head": "fc5a00b31f702e82377aa1010395af7ba8cff4f7",
    "sdk_tree": "903af44f9aab5684443ddb22e505b0ea811d45d2",
    "tree": "2b0ee576bf8a564d6f05e1f0003cd804e4b6adc7"
  },
  "configuration": {
    "automatic_gameplay_input": false,
    "collector_enabled": false,
    "command": "& 'C:\\Dev\\Fable2Recomp\\out\\phase5a\\sessions\\phase5a-native-001\\Launch.ps1'",
    "game_data_root": "C:\\Dev\\Fable2Recomp\\assets\\runtime",
    "gpu_plugin": "xenos",
    "invocation_record": "C:\\Dev\\Fable2Recomp\\out\\phase5a\\sessions\\phase5a-native-001\\invocation.json",
    "log_level": "debug",
    "log_pattern": "C:\\Dev\\Fable2Recomp\\fable2-run-NNN.log",
    "update_data_root": "C:\\Dev\\Fable2Recomp\\assets\\update",
    "user_data_root": "C:\\Dev\\Fable2Recomp\\out\\phase5a\\sessions\\phase5a-native-001\\user-data"
  },
  "handoff": {
    "end_save_source": null,
    "native_destination": null,
    "next_session": null,
    "preserved_endpoint": null
  },
  "limitations": [
    "Not launched; no native endpoint gameplay outcome is claimed.",
    "Short load/control/basic-interaction/save/exit test only; full preceding reference tranche will not be replayed."
  ],
  "outcome": {
    "fatal_or_guest_exception": null,
    "hang": null,
    "interaction_progression": null,
    "invalid_target": null,
    "loading_transition": null,
    "rendering": null,
    "result": null,
    "save_reload_exit": null
  },
  "performance_observations": [],
  "runtime": "native_normal",
  "schema_version": 1,
  "session_id": "phase5a-native-001",
  "shutdown": {
    "flush_reason": null,
    "footer_count": null,
    "user_report": null,
    "validation": null
  },
  "starting_checkpoint": {
    "area": "Oakfield tavern",
    "evidence": "User-reported reference endpoint; exact seven-file payload copy",
    "mainsave": {
      "bytes": 415039,
      "sha256": "13FC340F6869DA73CB958BA36CB50905E29B8FBEA073CEFF46490DB4A9812489"
    },
    "native_metadata_source": "C:\\Dev\\Fable2Recomp\\out\\phase5a\\checkpoints\\start-001\\native-save",
    "preserved_source": "C:\\Dev\\Fable2Recomp\\out\\phase5a\\checkpoints\\end-001\\xenia-content",
    "source_reference_session": "phase5a-reference-001",
    "writable_root": "C:\\Dev\\Fable2Recomp\\out\\phase5a\\sessions\\phase5a-native-001\\user-data"
  },
  "status": "prepared",
  "target_review": {
    "applied_changes": [],
    "classifications": {},
    "known_targets": null,
    "new_pairs": null,
    "new_targets": null
  },
  "timing": {
    "process_end_utc": null,
    "process_start_utc": null,
    "sampling_seconds": null,
    "source": null
  },
  "title_identity": {
    "base_xex_sha256": "88C4EF2E18E65409444D1B068EFF921D1F7E180A5AE64EDC64BA6B0872372662",
    "executable_memory_fingerprint_algorithm": "fable2-executable-memory-sha256-v1",
    "executable_memory_sha256": "5C8B78B84C93028D166E3DF347206E6642BA40BF374AD1AF8D958B2211320357",
    "executable_sections": [
      {
        "end": "0x832BABBC",
        "name": ".text",
        "permissions": "r-x",
        "sha256": "1B9F2E80280637FE2287286ED3FE18B367F378E24A695A2B8AB50B9ACD8FC724",
        "size": "0x0114ABBC",
        "start": "0x82170000"
      },
      {
        "end": "0x832CA03C",
        "name": "BINK",
        "permissions": "r-x",
        "sha256": "D715B7B4F3E7912489DBBBA3FF2642B1907479CBEDBDF974CD043827DB707146",
        "size": "0x0000F43C",
        "start": "0x832BAC00"
      }
    ],
    "image_base": "0x82000000",
    "image_size": "0x01620000",
    "media_id": "0x716F0A0D",
    "observed_tu1_confirmed": null,
    "patched_image_sha256": "BF7300F7E0DEEE91444ACD50FBE69752F5CFD3CF51358186F1B849DF25A8CB00",
    "shared_evidence_path": "tools/fable2-entrypoint-closure-evidence.json",
    "shared_evidence_sha256": "54C6A14EA06EA217B09E784026B2C9A11A5AC325EE838B003A1DDFC8E6BAB02E",
    "title_id": "0x4D5307F1",
    "title_update_container_file": "TU_16L61VH_0000038000000.000000000008Q",
    "title_update_container_sha256": "B36EB38CE1DB9E1195DEA494C8E75D5AB4BE737DCEF10565EF16A415DE27524C",
    "title_update_sha256": "046A05693B4DA4437083C784000A850858B3BF992955C7DB30D518FB3E53E41C",
    "version": "0.0.1.26",
    "xenia_module_fingerprint": "341151E9932EC14CB4F520AA9DE35BCF7169BFE1",
    "xenia_module_fingerprint_algorithm": "sha1_contiguous_loaded_executable_memory"
  },
  "user_coverage": {
    "areas": [],
    "categories": [],
    "confirmation": null
  }
}
